"VegaIndexer: A Distributed composite index scheme for big spatio-temporal sensor data on cloud","Y. Zhong; J. Fang; X. Zhao","Institute of Computing Technology, Chinese Academy of Sciences, Beijing, China; Institute of Computing Technology, Chinese Academy of Sciences, Beijing, China; Institute of Computing Technology, Chinese Academy of Sciences, Beijing, China","2013 IEEE International Geoscience and Remote Sensing Symposium - IGARSS","27 Jan 2014","2013","","","1713","1716","With the prevalence of data-intensive geospatial applications, massive spatio-temporal sensor data are obtained and the big data have posed grand challenges on existing index methods based on spatial databases due to their intrinsic poor scalability and retrieval efficiency. Motivated by the deficiencies, in this paper, we propose a distributed composite spatio-temporal index scheme called VegaIndexer for efficiently answering queries from large collections of space-time sensor data. Firstly, we present a distributed spatio-temporal indexing architecture based on cloud platform which consists of global index and local index. Moreover, we propose Multi-version Distributed enhanced R<sup>+</sup> (MDR<sup>+</sup>) tree algorithm for accelerating data retrieval and spatio-temporal query efficiency. Furthermore, we design a MapReduce-based parallel processing approach of batch constructing indices for big spatiotemporal sensor data. In addition, we implement VegaIndexer middleware on top of the leading cloud platform, i.e., Hadoop and associated NoSQL database. The experimental experiments show that VegaIndexer outperforms the index methods of typical spatial databases.","2153-7003","978-1-4799-1114-1","10.1109/IGARSS.2013.6723126","","https://ieeexplore.ieee.org/stamp/stamp.jsp?arnumber=6723126","Spatio-temporal index;big data management;WebGIS;spatial cloud computing;Internet of Things","Indexes;Distributed databases;Computer architecture;Real-time systems;Geospatial analysis;Spatial databases;Acceleration","cloud computing;database indexing;geophysical image processing;middleware;parallel programming;query processing;spatiotemporal phenomena;visual databases","distributed composite index scheme;big spatio-temporal sensor data;data-intensive geospatial applications;massive spatiotemporal sensor data;index methods;spatial databases;poor scalability;retrieval efficiency;spatiotemporal index scheme;queries;space-time sensor data;cloud platform;global index;local index;Multi-version Distributed enhanced R+;MDR+ tree algorithm;data retrieval;MapReduce-based parallel processing approach;batch constructing indices;big spatiotemporal sensor data;VegaIndexer middleware;Hadoop;associated NoSQL database","","8","","8","","27 Jan 2014","","","IEEE","IEEE Conferences"
"On the Application and Performance of MongoDB for Climate Satellite Data","P. Ameri; U. Grabowski; J. Meyer; A. Streit","Steinbuch Centre for Comput., Karlsruhe Inst. of Technol., Eggenstein, Germany; Inst. for Meteorol. & Climate Res.-Atmos. Trace Gases & Remote Sensing, Karlsruhe Institue of Technol. (KIT), Eggenstein, Germany; Steinbuch Centre for Comput., Karlsruhe Inst. of Technol., Eggenstein, Germany; Steinbuch Centre for Comput., Karlsruhe Inst. of Technol., Eggenstein, Germany","2014 IEEE 13th International Conference on Trust, Security and Privacy in Computing and Communications","19 Jan 2015","2014","","","652","659","Analyses in climate research typically operate on large datasets stored in file hierarchies. However, e.g. Indexing, meta-data search and replication is challenging with this approach. A new approach is to store and index datasets in large, distributed databases. In order to demonstrate the performance improvement, we utilized the so-called general matching problem between measurements of two satellites that differ in orbits and measurement cycles. For comparison purpose the measurements are matched within a specified maximum spatial and time offset constraint. We describe the steps from a single-threaded approach using a SQL database to a multi-threaded approach using the NoSQL database MongoDB. The performance as well as limitations on CPU and I/O are evaluated and discussed for each approach. The performance has been improved up to a factor of 46 using 11 threads on a 12-core system.","2324-9013","978-1-4799-6513-7","10.1109/TrustCom.2014.84","","https://ieeexplore.ieee.org/stamp/stamp.jsp?arnumber=7011308","MongoDB;NoSQL;geospatial;performance;MySQL","Databases;Servers;Instruction sets;Meteorology;Atmospheric measurements;Satellites;Extraterrestrial measurements","artificial satellites;distributed databases;file organisation;geophysics computing;multi-threading;SQL","climate satellite data;file hierarchies;meta-data search;distributed databases;single-threaded approach;multithreaded approach;NoSQL database MongoDB","","10","","29","","19 Jan 2015","","","IEEE","IEEE Conferences"
"Big Data Management of Sea Surface Wind Data","F. R. Rodríguez; D. T. Villa; J. P. Cambero; D. J. Merino Fernández","Department of Computer Science and Telematic System Engineering, University of Extremadura, School of Technology, Cáceres, Spain; Department of Computer Science and Telematic System Engineering, University of Extremadura, School of Technology, Cáceres, Spain; Department of Computer Science and Telematic System Engineering, University of Extremadura, School of Technology, Cáceres, Spain; Department of Computer Science and Telematic System Engineering, University of Extremadura, School of Technology, Cáceres, Spain","IGARSS 2018 - 2018 IEEE International Geoscience and Remote Sensing Symposium","4 Nov 2018","2018","","","990","993","Global wind data are increasingly used in many applications and research fields because it provides global coverage of ocean surface winds with an unprecedented view, and data are available at a sufficiently large spatial scale and high temporal resolution. NoSQL databases are increasingly used in Big Data applications due to its simplicity and flexibility of the data models design, the effectiveness of recoveries, the control over the system availability, and their horizontal scaling. Thus, the integration of heterogeneous data sources in only one NoSQL database repository, to select and recover diverse regions of interest of geospatial wind data, to analyze them via Data Mining applications, and to visualized their results, are the main objectives of this work.","2153-7003","978-1-5386-7150-4","10.1109/IGARSS.2018.8519604","","https://ieeexplore.ieee.org/stamp/stamp.jsp?arnumber=8519604","Geospatial Big Data;Wind data;Geospatial Data Mining;Geospatial data Integration;NoSQL databases","NoSQL databases;Sea surface;Geospatial analysis;Wind;Data mining;Data visualization","Big Data;data mining;data models;geographic information systems;oceanography;wind","Big Data management;sea surface wind Data;global wind data;global coverage;ocean surface winds;high temporal resolution;NoSQL databases;Big Data applications;horizontal scaling;heterogeneous data sources;NoSQL database repository;geospatial wind data;Data Mining applications","","1","","24","","4 Nov 2018","","","IEEE","IEEE Conferences"
"Next-generation geospatial-temporal information technologies for disaster management","C. M. Albrecht; B. Elmegreen; O. Gunawan; H. F. Hamann; L. J. Klein; S. Lu; F. Mariano; C. Siebenschuh; J. Schmude",NA; NA; NA; NA; NA; NA; NA; NA; NA,"IBM Journal of Research and Development","25 Feb 2020","2020","64","1/2","5:1","5:12","Traditional geographic information systems (GIS) have been disrupted by the emergence of Big Data in the form of geo-coded raster, vector, and time-series Internet-of-Things data. This article discusses the application of new scalable technologies that go far beyond relational databases and file-based storage on spinning disk or tape to incorporate both storage and processing data in the same platform. The roles of the Apache Hadoop Distributed File Systems and NoSQL key-value stores such as the Apache Hbase are discussed, along with indexing schemes that optimally support geospatial-temporal use. We highlight how this new approach can rapidly search multiple GIS data layers to obtain insights in the context of early warning, impact evaluation, response, and recovery to earthquake and wildfire disasters.","0018-8646","","10.1147/JRD.2020.2970903","IBM; ","https://ieeexplore.ieee.org/stamp/stamp.jsp?arnumber=8977382","","Geospatial analysis;Satellites;Meteorology;Indexing;Earth;Next generation networking","","","","1","","50","IBM","31 Jan 2020","","","IBM","IBM Journals"
"A multidimensional data storage model for location based application on Hbase","C. Nitnaware; A. Khan","Department of Computer Technology, YCCE Nagpur (India); Department of Computer Technology, YCCC Nagpur (India)","2015 International Conference on Innovations in Information, Embedded and Communication Systems (ICIIECS)","13 Aug 2015","2015","","","1","5","In the recent years one of the database application challenge is to manage large amounts of terabytes of data which contains more and more complex data without sacrifying the real time querying requirements. Client server architecture is used mostly to develop specialized servers optimized to manage most of the database applications. Until recently, most of the organizations were using relational database management systems for their applications as data administration. But, as the data is consistently increasing, so RDBMs cannot handle growing amounts of terabytes of data, such applications require other kinds of databases such as NOSQL databases. A NoSQL (Not Only SQL) database is simple in design and can store terabytes of data with finer control over availability. NoSQL databases such as Hbase are widely used in big data and real-time applications. In Hbase, data is present in a collection of key-value pairs and each possible key is unique in the collection. we present the index structure using quad tree over Hbase which can insert large number of multidimensional data based on location and response time of nearest neighbor queries as lower than traditional Relational DBMS system.","","978-1-4799-6818-3","10.1109/ICIIECS.2015.7193237","","https://ieeexplore.ieee.org/stamp/stamp.jsp?arnumber=7193237","multidimensional data;key-value store;hbase;location based applications;Nosql database","Indexes;Conferences;Mobile communication;Servers;Geospatial analysis;Query processing","Big Data;query processing;relational databases;SQL","nearest neighbor queries;response time;multidimensional data;quad tree;key-value pairs;big data;Hbase;Not Only SQL database;NOSQL databases;RDBM;relational database management systems;specialized servers;client server architecture;real time querying requirements;database application challenge","","1","","21","","13 Aug 2015","","","IEEE","IEEE Conferences"
"Enabling Serverless Deployment of Large-Scale AI Workloads","A. Christidis; S. Moschoyiannis; C. -H. Hsu; R. Davies","Department of Computer Science, University of Surrey, Guildford, U.K.; Department of Computer Science, University of Surrey, Guildford, U.K.; School of Mathematics and Big Data, Foshan University, Foshan, China; EMU Analytics, London, U.K.","IEEE Access","22 Apr 2020","2020","8","","70150","70161","We propose a set of optimization techniques for transforming a generic AI codebase so that it can be successfully deployed to a restricted serverless environment, without compromising capability or performance. These involve (1) slimming the libraries and frameworks (e.g., pytorch) used, down to pieces pertaining to the solution; (2) dynamically loading pre-trained AI/ML models into local temporary storage, during serverless function invocation; (3) using separate frameworks for training and inference, with ONNX model formatting; and, (4) performance-oriented tuning for data storage and lookup. The techniques are illustrated via worked examples that have been deployed live on geospatial data from the transportation domain. This draws upon a real-world case study in intelligent transportation looking at on-demand, real-time predictions of flows of train movements across the UK rail network. Evaluation of the proposed techniques shows the response time, for varying volumes of queries involving prediction, to remain almost constant (at 50 ms), even as the database scales up to the 250M entries. The query response time is important in this context as the target is predicting train delays. It is even more important in a serverless environment due to the stringent constraints on serverless functions' runtime before timeout. The similarities of a serverless environment to other resource constrained environments (e.g., IoT, telecoms) means the techniques can be applied to a range of use cases.","2169-3536","","10.1109/ACCESS.2020.2985282","EIT Digital IVZW through the Real-Time Flow Project(grant numbers:18387–SGA201); EPSRC IAA Project AGELink(grant numbers:EP/R511791/1); National Natural Science Foundation of China(grant numbers:61872084); ","https://ieeexplore.ieee.org/stamp/stamp.jsp?arnumber=9055400","Intelligent transportation;predicting train delays;AWS;functions as-a-service;Lambda;NoSQL;serverless;resource-constrained;serverless codebase optimization;rail traffic big data","Libraries;Load modeling;Computer architecture;Real-time systems;Predictive models;Optimization","intelligent transportation systems;learning (artificial intelligence);optimisation;query processing;railways","data storage;geospatial data;intelligent transportation;train movements;UK rail network;query response time;train delays;serverless functions;resource constrained environments;serverless deployment;large-scale AI workloads;optimization techniques;generic AI codebase;restricted serverless environment;local temporary storage;serverless function invocation;inference;ONNX model formatting;pretrained AI/ML models","","2","","46","CCBY","2 Apr 2020","","","IEEE","IEEE Journals"
"Antares: A Scalable, Real-Time, Fault Tolerant Data Store for Spatial Analysis","R. Simmonds; P. Watson; J. Halliday","Sch. of Comput. Sci., Newcastle Univ., Newcastle upon Tyne, UK; Sch. of Comput. Sci., Newcastle Univ., Newcastle upon Tyne, UK; NA","2015 IEEE World Congress on Services","17 Aug 2015","2015","","","105","112","The growth of mobile devices has significantly increased the velocity and volume of location-based data. Whilst there is enormous potential for applications that exploit this data in real-time, storing and querying it in real-time creates significant challenges. Traditional RDBMS systems are not sufficiently scalable, while typical cloud-based solutions such as map-reduce do not possess the capabilities required for real-time, spatial-data processing. Therefore, new approaches are needed. In this paper we explore the use of NoSQL technologies. These offer scalability, availability and fault tolerance, but -- as we show -- do not perform well with spatial data. Therefore, in this paper we address this challenge by enhancing existing spatial indexing structures with novel algorithms for inserting and searching spatial data. We have implemented this in a NoSQL solution (Antares), and evaluated it against two other NoSQL solutions, and a range of indexing structures: Kd-Tree, Quad Tree and Geohashing. The results show that Antares significantly outperforms the other approaches.","2378-3818","978-1-4673-7275-6","10.1109/SERVICES.2015.24","","https://ieeexplore.ieee.org/stamp/stamp.jsp?arnumber=7196511","NoSQL databases;multidimensional analysis;geospatial analysis;real-time;scalability","Spatial databases;Vegetation;Indexing;Real-time systems;Scalability","database indexing;fault tolerant computing;query processing;spatial data structures;visual databases","Antares;scalable real-time fault tolerant data store;spatial analysis;mobile devices;location-based data;data querying;RDBMS system;cloud-based solutions;real-time spatial-data processing;NoSQL technology;fault tolerance;spatial indexing structure;spatial data insertion;spatial data searching;indexing structures;Kd-Tree;Quad Tree;Geohashing","","2","","14","","17 Aug 2015","","","IEEE","IEEE Conferences"
